ae_id,speaker,start_time,end_time,sentence,source,targets
IS1009d.A.argumentstructs.Daan.6,A,790.05,797.184,"Now what, what are our special features for the marketing ? That's really the voice recognition that's really unusual",NONE,"IS1009d.D.argumentstructs.Daan.3, IS1009d.A.argumentstructs.Daan.7"
IS1009d.D.argumentstructs.Daan.3,D,796.32,802.57,I think voice recognition is our big selling point 'cause nobody else seems to have that in in this price range.,IS1009d.A.argumentstructs.Daan.6,NONE
IS1009d.C.argumentstructs.14,C,799.16,835.99,Mm. Mm-hmm. Mm. Mm. Mm-hmm.,NONE,NONE
IS1009d.A.argumentstructs.Daan.7,A,802.76,809.37,"And then, and then the other thing would basically be sh shape or practicality of use.",IS1009d.A.argumentstructs.Daan.6,"IS1009d.D.argumentstructs.Daan.4, IS1009d.A.argumentstructs.Daan.8"
IS1009d.D.argumentstructs.Daan.4,D,809.81,823.31,"Yep uh well I think that everybody's gonna say their remote control is practical. I think we have to, we have to dwell on on on the appearance. We're really gonna have the be the",IS1009d.A.argumentstructs.Daan.7,NONE
IS1009d.A.argumentstructs.Daan.8,A,811.09,817.85,You know. Colours.,IS1009d.A.argumentstructs.Daan.7,IS1009d.D.argumentstructs.Daan.5
IS1009d.A.argumentstructs.23,A,820.76,827.1,Mm-hmm. Cutest. Yeah.,NONE,NONE
IS1009d.D.argumentstructs.Daan.5,D,824.45,837.62,"cutest remote control on the block. So I think we have to play with the image, play with the snail image um play with the visual and then the voice recognition. I think those are the two things to push. The look",IS1009d.A.argumentstructs.Daan.8,IS1009d.D.argumentstructs.Daan.6
IS1009d.D.argumentstructs.Daan.6,D,838.97,841.85,and the voice recognition. They're gonna be our two selling points.,IS1009d.D.argumentstructs.Daan.5,NONE
